{
  "$schema": "./schemas/otto-batch.schema.json",
  "batch_id": "OTTO-2026-08-13",
  "version": "1.0.0",
  "generated_on": "2026-08-13",
  "generated_by": "Claude (Cowork) — from the ReloPass Notion AI Work Queue + live production reads",
  "purpose": "Offload the research half of eight long-stuck ReloPass tasks to Otto (Audos), with a defined recovery path, machine-checkable quality gates, and an explicit reintegration route back into ReloPass.",
  "contract": {
    "source_of_truth": "docs/audos-card-contract.md",
    "rules_honoured": [
      "R1 results go to the synced repo, not into chat",
      "R2 no sub-tasks (with the R7 single-write-task exception, authorised per card)",
      "R3 record the deploy commit, never gate on it",
      "R4 paste the card, never attach it",
      "R5 send research, not browser QA — every card in this batch is research",
      "R6 a blocked path is a finding; [VERIFIED] / [CLAIM] on every claim",
      "R7 Otto in chat cannot write files; the sync writes to a DOUBLED path"
    ],
    "known_hazards": [
      "Chat prose is write-only: virtualised scroll, no wheel scroll, get_page_text wrong container, JS blocked. Never accept a table in the thread as the deliverable.",
      "Otto has reported writing a file that did not exist. Always demand raw `ls -la` + `wc -l` and always verify in git.",
      "A 'convert-only' second pass DRIFTED into fresh research. Every card in this batch therefore emits a thread fallback block that the verifier diffs against the synced file.",
      "Attachments returned 'file is fetching but returning empty content' on 2 of 4 cards. Paste, never attach."
    ]
  },
  "workspace": {
    "repo_root_marker": "CLAUDE.md",
    "sync_dir": "audos-workspace-776786",
    "data_dir": "audos-workspace-776786/data",
    "doubled_path": "audos-workspace-776786/audos-workspace-776786/data",
    "doubled_path_note": "Otto writes to 'audos-workspace-776786/data/...' from inside a workspace whose root already maps to 'audos-workspace-776786/', so the prefix appears twice. Search BOTH before concluding a file is missing. otto_recover.sh does this and moves the file to the un-doubled path.",
    "thread_capture_dir": "audos-workspace-776786/data/_threads",
    "thread_capture_note": "Paste Otto's in-thread fallback block here as <card_id>.thread.txt BEFORE authorising any write task. This is the only defence against the measured convert-only drift."
  },
  "notion": {
    "database": "AI Work Queue",
    "database_id": "3bc887c6-4d48-8089-8188-fcf2dc3edc1b",
    "data_source": "collection://4e2887c6-4d48-82c1-931e-87b09fb5c4ed",
    "status_value_on_handoff": "Otto ready",
    "status_value_on_return": "Human Review",
    "status_value_if_refuted": "Needs Human Clarification",
    "execution_notes_stamp": "OTTO READY — card {card_id} (batch {batch_id}). Card text: docs/audos/otto-batch-2026-08-13/cards/{card_file}. Research half only; the ReloPass half stays with {owner_agent}."
  },
  "how_to_run": {
    "open_a_thread": "Start a meeting → scroll to the bottom → General Chat. The 'Ping Otto' button does not open a composer.",
    "one_card_per_thread": true,
    "paste_not_attach": true,
    "clear_the_board_first": "Clear the READY FOR REVIEW column before pasting — there is no point adding results to a bin nobody reads.",
    "parallelism": "Cards within a wave run in parallel, each in its own thread. Do not start a later wave until the current wave's files are verified in git."
  },
  "waves": [
    {
      "wave": 1,
      "name": "The four longest-stuck P1s",
      "cards": [
        "OTTO-G",
        "OTTO-H",
        "OTTO-I",
        "OTTO-J"
      ],
      "rationale": "Each is a P1 or P1-equivalent that has been blocked for weeks or months on a research question sitting in an engineering queue. Two are measured-zero data gaps (IE and FR supplier coverage), one is five register lookups, one is a two-month compliance block that is really a ten-vendor documentation problem. G revised to v2 on 2026-08-13 after OTTO-I measured the JavaScript-rendered-register failure mode; it now assesses anchors before harvesting."
    },
    {
      "wave": 2,
      "name": "Corridor accuracy",
      "cards": [
        "OTTO-K"
      ],
      "rationale": "Gates the ES_IE corridor's correctness. Runs after wave 1 so the Ireland supplier data and the Ireland lead times land close together for one corridor go-live."
    },
    {
      "wave": 3,
      "name": "Narrative, demand and coverage",
      "cards": [
        "OTTO-L",
        "OTTO-M",
        "OTTO-N"
      ],
      "rationale": "Lower priority, larger scope, and none is on a launch path. Run only once waves 1-2 have proved the return quality on this batch."
    }
  ],
  "cards": [
    {
      "card_id": "OTTO-G",
      "title": "Ireland registry anchors: assess, then harvest (v2)",
      "wave": 1,
      "kind": "research",
      "otto_mode": "chat_plus_one_authorised_write_task",
      "card_file": "cards/OTTO-G-ireland-supplier-registry-harvest.md",
      "notion_tasks": [
        {
          "aiq_id": 1815,
          "role": "primary",
          "priority": "P1",
          "status_before": "Blocked",
          "url": "https://app.notion.com/3b9887c64d4881a98624c8847db9ca04"
        }
      ],
      "informs": [
        1814,
        1817,
        1809
      ],
      "premise": {
        "measured_on": "2026-08-13",
        "source": "production supabase nsvefcvpvwwwhuqyuqmp",
        "fact": "supplier_service_capabilities has ZERO rows with country_code='IE'. Coverage exists only for AE, DE, NO, SG, US. Registry health overall: 93 suppliers, only 27 with any accreditation, only 10 verified, yet 62 capabilities approved and live. Irish register reachability measured the same day: psr.ie publishes an interactive table with no download; psra.ie 403; lawsociety.ie find-a-solicitor 404; Central Bank runs a downloads page and open-data portal; PSRA has a data.gov.ie publisher page."
      },
      "outputs": [
        {
          "path": "audos-workspace-776786/data/otto-g-ie-anchors.json",
          "format": "json",
          "required": true,
          "schema": "schemas/otto-outputs.schema.json#/$defs/ie_anchor_assessment",
          "min_records": 5,
          "max_records": 12
        },
        {
          "path": "audos-workspace-776786/data/otto-g-ie-suppliers.csv",
          "format": "csv",
          "required": true,
          "schema": "schemas/otto-outputs.schema.json#/$defs/supplier_harvest_row",
          "min_records": 0,
          "max_records": 60,
          "may_be_header_only": true
        },
        {
          "path": "audos-workspace-776786/data/otto-g-gaps.md",
          "format": "md",
          "required": true,
          "min_bytes": 40
        }
      ],
      "thread_fallback": {
        "format": "mixed",
        "blocks": [
          {
            "begin": "OTTO-G-ANCHORS-BEGIN",
            "end": "OTTO-G-ANCHORS-END",
            "format": "json"
          },
          {
            "begin": "OTTO-G-ROWS-BEGIN",
            "end": "OTTO-G-ROWS-END",
            "format": "psv"
          }
        ],
        "capture_as": "audos-workspace-776786/data/_threads/OTTO-G.thread.txt"
      },
      "quality_gates": [
        "file_present",
        "non_empty",
        "schema",
        "enum_discipline",
        "sourcing_rule",
        "no_org_number_as_accreditation",
        "source_not_own_site",
        "evidence_url_not_search_form",
        "label_discipline",
        "thread_diff",
        "url_resolves"
      ],
      "reintegration": {
        "owner_agent": "Claude Code",
        "target": "public.suppliers + public.supplier_service_capabilities",
        "writer": "backend/imports/suppliers/executor.py stage() then promote() — do NOT write a new writer",
        "steps": [
          "FIRST: read otto-g-ie-anchors.json. If every anchor is 'unusable', the CSV is beside the point and the real output is a sourcing-route decision — record it on AIQ-1815 before any code.",
          "stage() the CSV, dry-run, human approval, promote()",
          "capabilities land platform_vetting_status='pending' — never auto-approved",
          "CONFIRM LIVE: SELECT count(*) FROM supplier_service_capabilities WHERE country_code='IE'; — a merged migration is not live data, this repo has been bitten by that repeatedly (see AIQ-1809 notes)",
          "allowlist Dublin + Cork and enable IE vendor discovery (AIQ-1815 engineering half)",
          "add one RegistrySource per Irish anchor used to registry_sources.py"
        ],
        "constraints": [
          "verification_method must be one of public_registry|supplier_document|manual_email|directory_listing — 'registry_lookup' violates the CHECK",
          "status='claimed' is the floor; 'verified' only on live-register confirmation (accreditation_hardening.py)",
          "idempotent: a second run must create 0 rows",
          "any new public table needs RLS + a policy + REVOKE ALL FROM anon (CLAUDE.md hard gate)"
        ],
        "acceptance": "HR Vendor Management no longer shows 'Dublin, IE isn't on your allowlist yet'; coverage matrix has an IE column with non-zero core cells; 'Find verified vendors in Dublin' returns vendors; employee Housing Agencies for the Madrid→Dublin case shows >=1 provider."
      },
      "revision": {
        "version": 2,
        "date": "2026-08-13",
        "why": "v1 assumed the Irish registers would be reachable. OTTO-I measured that assumption failing in Norway: 0/4 rows, because both registers are JavaScript-rendered. Irish registers look the same shape, but bulk/open-data routes exist. v2 makes G two-stage like OTTO-H — assess the anchors first, harvest only from what survives — and adds the Q5 bulk-route question that v1 lacked."
      }
    },
    {
      "card_id": "OTTO-H",
      "title": "France-origin registry anchors: assess, then harvest",
      "wave": 1,
      "kind": "research",